,Company,URL,Title,Description
23,Skillsearch Limited,https://www.linkedin.com/company/skillsearch/people/?facetGeoRegion=103644278&keywords=painter%20painting,3D Character Artist,"About the job
If you have 3D Character Artist experience and youre seeking a new remote role, we want to hear from you. Skillsearch is helping a collaborative studio recruit a 3D Character Artist, and the remote role comes with an attractive salary and benefits package. You will join a small team of veterans and work on an ambitious AA third-person action-adventure game (unannounced). In your first few weeks in this 3D Character Artist role, you can expect to: Be responsible for creating hyper-realistic 3D human characters with detailed faces, clothing and armours, giving shape to the most important characters of the game Be a flexible and collaborative 3D character artist To apply for this 3D Character Artist role, you will need 3+ years of experience as an Environment Artist in a AA/AAA game studio. You will also require: Proficiency with modern industry-standard tools, workflows, techniques and pipelines for game dev Exceptional organic and hard-surface modelling skills and knowledge of Maya, Zbrush, Substance or equivalents Knowledge of Unreal Engine (essential) In return for your passion, collaborative approach and commitment, you will receive a generous salary and benefits package and join a friendly and inclusive culture. We'd love you to apply for this full-time remote 3D Character Artist job, and we're waiting to hear from you. Please contact Jay from Skillsearch at jrm@skillsearch.com today. Here at Skillsearch, we're a recruitment company. In the simplest form, this means we place people at new companies - but it's so much more than that. For the past 30 years, we've been busy helping people (like you) with sought after skills find jobs in the Games, Interactive and Enterprise Systems industries all around the globe. Our company comprises a team of dedicated consultants that work across various niche technologies, including Games, Virtual Reality, AR and XR, Workday, Oracle, Peoplesoft, and eCommerce. We are always exploring other cutting-edge markets. Follow us to see a few of the jobs we're working on, find out which events you can see us at, and keep up with news in the technology, gaming and interactive world. Welcome to Skillsearch!"
24,PeopleReady,https://www.linkedin.com/company/peopleready/people/?facetGeoRegion=103644278&keywords=painter%20painting,Painter,"About the job
This job is sourced from a job board. Learn more
We are seeking commercial painters for work in Wrentham, spray coat applicator on metal surfaces in new commercial building.Â

Note -Â

The pay rate for this job is $30 / hour Responsibilities:

Applying various finishes to equipment, buildings, or other structures
Applying primers or sealers to prepare new surfaces, such as metal, for finish coats Mixing colors or oils to obtain desired color or consistency Benefits:
Work with a team that is motivated to keep you busy.
PeopleReady Skilled trades offers weekly pay and flexible schedule working on a variety of projects in a large network of contractors.
Medical, dental, vision, life insurance, and sick time.
Opportunity to go thru OSHA 10 training if you don't have it already.
We offer referral bonuses where you can make up to $500 referring a journey level tradesperson
You can earn up to $1500 extra in our
Respect the Craft program based on working hours for us. Qualifications
Three to five years' experience in commercial painting preferred
Experience with commercial painting
Reliable transportation to and from different jobsites
Tools of the trade and the ability to bring them to the jobsite
References to verify your professional skills and experiences
Strong work ethic and positive attitude
Able to remain in a stationary position for long periods of time and able to occasionally lift and move 20 pounds For more information, please contact on the below details â€“ 1- Name â€“Â Ryan Sharp 2- Contact Number -Â (774)445-6635 \#SKILLEDTRD Â

PeopleReady is an equal opportunity employer, and we value diversity. We do not discriminate based on race, religious affiliation, color, national origin, gender, age, marital status, sexual orientation, gender identity, veteran status, disability, or any other basis protected by law. We will get to know you and connect you with jobs that match your skills, experience and preferences. We work hard every single day to find jobs so each employee has opportunity and variety in their work."
